{"$schema": "https://json-schema.org/draft/2020-12/schema", "$id": "urn:bajo-jazz-blues:lesson:1.2.0", "title": "Lesson content schema v1.1.0", "type": "object", "properties": {"$schema": {"type": "string", "minLength": 1}, "schemaVersion": {"const": "1.2.0"}, "lessonId": {"type": "string", "pattern": "^[BIA][0-9]{2}$"}, "level": {"enum": ["basic", "intermediate", "advanced"]}, "sequence": {"type": "integer", "minimum": 1}, "title": {"type": "string", "minLength": 1}, "language": {"type": "string", "minLength": 1}, "status": {"enum": ["draft", "pilot", "complete"]}, "estimatedMinutes": {"type": "integer", "minimum": 1}, "prerequisiteIds": {"type": "array", "items": {"type": "string", "minLength": 1}, "minItems": 0}, "prerequisiteNote": {"type": "string", "minLength": 1}, "learningObjectives": {"type": "array", "items": {"type": "string", "minLength": 1}, "minItems": 1}, "notationPolicy": {"type": "object", "properties": {"defaultsRef": {"type": "string", "minLength": 1}, "overrides": {"type": "object", "properties": {"scoreVisibility": {"enum": ["visible", "collapsible", "hidden"]}, "latinNamesVisibility": {"enum": ["visible", "collapsible", "hidden"]}, "chordSymbolsVisibility": {"enum": ["visible", "collapsible", "hidden"]}}, "required": [], "additionalProperties": false}, "materialOverrides": {"type": "array", "items": {"type": "object", "properties": {"materialId": {"type": "string", "minLength": 1}, "scoreVisibility": {"enum": ["visible", "collapsible", "hidden"]}, "latinNamesVisibility": {"enum": ["visible", "collapsible", "hidden"]}, "chordSymbolsVisibility": {"enum": ["visible", "collapsible", "hidden"]}, "reason": {"type": "string", "minLength": 1}}, "required": ["materialId", "reason"], "additionalProperties": false}, "minItems": 0}}, "required": ["defaultsRef", "overrides", "materialOverrides"], "additionalProperties": false}, "theory": {"type": "object", "properties": {"blocks": {"type": "array", "items": {"type": "object", "properties": {"blockId": {"type": "string", "minLength": 1}, "title": {"type": "string", "minLength": 1}, "text": {"type": "string", "minLength": 1}}, "required": ["blockId", "title", "text"], "additionalProperties": false}, "minItems": 1}}, "required": ["blocks"], "additionalProperties": false}, "musicalMaterials": {"type": "array", "items": {"type": "object", "properties": {"materialId": {"type": "string", "minLength": 1}, "title": {"type": "string", "minLength": 1}, "musicXmlAssetId": {"type": "string", "minLength": 1}, "chordEventsSource": {"enum": ["derivedFromMusicXml", "validatedAgainstMusicXml"]}, "chordEvents": {"type": "array", "items": {"type": "object", "properties": {"bar": {"type": "integer", "minimum": 1}, "beat": {"type": "number", "minimum": 1}, "symbol": {"type": "string", "minLength": 1}, "durationBeats": {"type": "number", "exclusiveMinimum": 0}}, "required": ["bar", "beat", "symbol", "durationBeats"], "additionalProperties": false}, "minItems": 1}, "latinNoteLabels": {"type": "array", "items": {"type": "object", "properties": {"noteId": {"type": "string", "minLength": 1}, "label": {"type": "string", "minLength": 1}}, "required": ["noteId", "label"], "additionalProperties": false}, "minItems": 0}, "description": {"type": "string", "minLength": 1}, "renderAssetIds": {"type": "array", "items": {"type": "string", "minLength": 1}, "minItems": 1}, "audioAssetId": {"type": "string", "minLength": 1}, "noteRole": {"type": "string"}}, "required": ["materialId", "title", "musicXmlAssetId", "chordEventsSource", "chordEvents", "latinNoteLabels", "description", "renderAssetIds", "audioAssetId", "noteRole"], "additionalProperties": false}, "minItems": 1}, "examples": {"type": "array", "items": {"type": "object", "properties": {"exampleId": {"type": "string", "minLength": 1}, "materialId": {"type": "string", "minLength": 1}, "explanation": {"type": "string", "minLength": 1}}, "required": ["exampleId", "materialId", "explanation"], "additionalProperties": false}, "minItems": 1}, "readingExercises": {"type": "array", "items": {"type": "object", "properties": {"exerciseId": {"type": "string", "minLength": 1}, "prompt": {"type": "string", "minLength": 1}, "materialId": {"type": "string", "minLength": 1}, "bar": {"type": "integer", "minimum": 1}, "responseType": {"type": "string", "minLength": 1}, "answerKey": {"type": "object"}, "feedback": {"type": "string", "minLength": 1}}, "required": ["exerciseId", "prompt", "materialId", "bar", "responseType", "answerKey", "feedback"], "additionalProperties": false}, "minItems": 1}, "earTraining": {"type": "object", "properties": {"objective": {"type": "string", "minLength": 1}, "verificationMaterialId": {"type": "string", "minLength": 1}, "audioAssetId": {"type": "string", "minLength": 1}, "instructions": {"type": "array", "items": {"type": "string", "minLength": 1}, "minItems": 1}, "trials": {"type": "array", "items": {"type": "object", "properties": {"trial": {"type": "integer", "minimum": 1}, "startBeat": {"type": "number", "minimum": 0}, "listenBeats": {"type": "integer", "minimum": 1}, "responseBeats": {"type": "integer", "minimum": 1}, "answerSymbol": {"type": "string", "minLength": 1}, "answerRootLatin": {"type": "string", "minLength": 1}, "answerNotes": {"type": "array", "items": {"type": "string"}}}, "required": ["trial", "startBeat", "listenBeats", "responseBeats", "answerSymbol", "answerRootLatin"], "additionalProperties": false}, "minItems": 1}, "target": {"type": "string", "minLength": 1}}, "required": ["objective", "verificationMaterialId", "audioAssetId", "instructions", "trials", "target"], "additionalProperties": false}, "improvisation": {"type": "object", "properties": {"objective": {"type": "string", "minLength": 1}, "progressionMaterialId": {"type": "string", "minLength": 1}, "constraints": {"type": "array", "items": {"type": "string", "minLength": 1}, "minItems": 1}, "steps": {"type": "array", "items": {"type": "string", "minLength": 1}, "minItems": 1}, "backingTrack": {"type": "object", "properties": {"format": {"const": "midi"}, "assetId": {"type": "string", "minLength": 1}, "audioPreviewAssetId": {"type": "string", "minLength": 1}, "guideAssetId": {"type": "string", "minLength": 1}, "guideAudioPreviewAssetId": {"type": "string", "minLength": 1}, "tempoBpm": {"type": "number", "exclusiveMinimum": 0}, "meter": {"type": "string", "minLength": 1}, "feel": {"type": "string", "minLength": 1}, "countInBars": {"type": "integer", "minimum": 0}, "chorusBars": {"type": "integer", "minimum": 1}, "chorusCount": {"type": "integer", "minimum": 1}, "outroBars": {"type": "integer", "minimum": 0}, "loopStartBeat": {"type": "number", "minimum": 0}, "loopEndBeatExclusive": {"type": "number", "exclusiveMinimum": 0}, "loopCoordinates": {"type": "string", "minLength": 1}, "tracks": {"type": "array", "items": {"type": "object", "properties": {"trackId": {"type": "string", "minLength": 1}, "role": {"enum": ["harmony", "drums", "bassGuide"]}, "midiChannel": {"type": "integer", "minimum": 1, "maximum": 16}, "mutedByDefault": {"type": "boolean"}, "availableInGuideAssetOnly": {"type": "boolean"}}, "required": ["trackId", "role", "midiChannel", "mutedByDefault"], "additionalProperties": false}, "minItems": 1}}, "required": ["format", "assetId", "audioPreviewAssetId", "guideAssetId", "guideAudioPreviewAssetId", "tempoBpm", "meter", "feel", "countInBars", "chorusBars", "chorusCount", "outroBars", "loopStartBeat", "loopEndBeatExclusive", "loopCoordinates", "tracks"], "additionalProperties": false}}, "required": ["objective", "progressionMaterialId", "constraints", "steps", "backingTrack"], "additionalProperties": false}, "instrumentAdaptations": {"type": "array", "items": {"type": "object", "properties": {"instrument": {"enum": ["electricBass", "doubleBass"]}, "instructions": {"type": "array", "items": {"type": "string", "minLength": 1}, "minItems": 1}}, "required": ["instrument", "instructions"], "additionalProperties": false}, "minItems": 1}, "practicePlan": {"type": "array", "minItems": 4, "maxItems": 4, "items": {"type": "object", "properties": {"sessionNumber": {"type": "integer", "minimum": 1}, "tasks": {"type": "array", "items": {"type": "object", "properties": {"taskId": {"type": "string", "minLength": 1}, "instruction": {"type": "string", "minLength": 1}, "minutes": {"type": "integer", "minimum": 1}, "materialId": {"type": "string", "minLength": 1}}, "required": ["taskId", "instruction", "minutes"], "additionalProperties": false}, "minItems": 1}}, "required": ["sessionNumber", "tasks"], "additionalProperties": false}}, "selfAssessment": {"type": "object", "properties": {"questions": {"type": "array", "items": {"type": "object", "properties": {"questionId": {"type": "string", "minLength": 1}, "prompt": {"type": "string", "minLength": 1}, "answerKey": {"type": "string", "minLength": 1}, "explanation": {"type": "string", "minLength": 1}}, "required": ["questionId", "prompt", "answerKey", "explanation"], "additionalProperties": false}, "minItems": 1}, "performanceCriteria": {"type": "array", "items": {"type": "object", "properties": {"criterionId": {"type": "string", "minLength": 1}, "description": {"type": "string", "minLength": 1}, "target": {"type": "string", "minLength": 1}, "retryAdvice": {"type": "string", "minLength": 1}}, "required": ["criterionId", "description", "target", "retryAdvice"], "additionalProperties": false}, "minItems": 1}}, "required": ["questions", "performanceCriteria"], "additionalProperties": false}, "externalResources": {"type": "array", "items": {"type": "object", "properties": {"resourceId": {"type": "string", "minLength": 1}, "title": {"type": "string", "minLength": 1}, "creator": {"type": "string", "minLength": 1}, "resourceType": {"type": "string", "minLength": 1}, "url": {"type": "string", "format": "uri"}, "language": {"type": "string", "minLength": 1}, "accessNotes": {"type": "string", "minLength": 1}, "relevantLessonIds": {"type": "array", "items": {"type": "string", "minLength": 1}, "minItems": 1}, "purpose": {"type": "string", "minLength": 1}, "linkCheckedAt": {"type": "string", "format": "date"}, "verificationScope": {"type": "string", "minLength": 1}, "videoPlaybackVerified": {"type": "boolean"}}, "required": ["resourceId", "title", "creator", "resourceType", "url", "language", "accessNotes", "relevantLessonIds", "purpose", "linkCheckedAt", "verificationScope"], "additionalProperties": false}, "minItems": 1}, "assets": {"type": "array", "items": {"type": "object", "properties": {"assetId": {"type": "string", "minLength": 1}, "mediaType": {"type": "string", "minLength": 1}, "relativePath": {"type": "string", "pattern": "^(?!/)(?!.*\\.\\.).+"}, "sha256": {"type": "string", "pattern": "^[a-f0-9]{64}$"}}, "required": ["assetId", "mediaType", "relativePath", "sha256"], "additionalProperties": false}, "minItems": 1}, "validation": {"type": "object", "properties": {"status": {"enum": ["pendingVisualReview", "pass", "fail"]}, "checks": {"type": "array", "items": {"type": "object", "properties": {"checkId": {"type": "string", "minLength": 1}, "status": {"enum": ["pass", "fail", "notPerformed"]}, "notes": {"type": "string", "minLength": 1}, "evidenceAssetId": {"type": "string", "minLength": 1}}, "required": ["checkId", "status", "notes"], "additionalProperties": false}, "minItems": 0}, "reviewedAt": {"type": ["string", "null"]}}, "required": ["status", "checks", "reviewedAt"], "additionalProperties": false}, "fretboardMaps": {"type": "array", "items": {"type": "object", "required": ["instrument", "assetId", "root", "degrees", "geometry", "patternMaterialId"], "properties": {"instrument": {"enum": ["electricBass", "doubleBass"]}, "assetId": {"type": "string"}, "root": {"type": "string"}, "degrees": {"type": "array", "items": {"type": "string"}}, "geometry": {"type": "string"}, "patternMaterialId": {"type": "string"}}}}}, "required": ["$schema", "schemaVersion", "lessonId", "level", "sequence", "title", "language", "status", "estimatedMinutes", "prerequisiteIds", "prerequisiteNote", "learningObjectives", "notationPolicy", "theory", "musicalMaterials", "examples", "readingExercises", "earTraining", "improvisation", "instrumentAdaptations", "practicePlan", "selfAssessment", "externalResources", "assets", "validation", "fretboardMaps"], "additionalProperties": false}