{"$schema": "../../lesson.schema.json", "schemaVersion": "1.2.0", "lessonId": "I12", "level": "intermediate", "sequence": 12, "title": "Improvisación con notas guía y motivos", "language": "es-AR", "status": "complete", "estimatedMinutes": 240, "prerequisiteIds": ["I11"], "prerequisiteNote": "Progresión semanal orientativa: repite la semana si aún no conservas pulso, forma y lectura.", "learningObjectives": ["Leer el cifrado de esta lección y localizar sus notas en clave de fa.", "Explicar el contraste principal: ¿Qué dos elementos permiten reconocer un motivo cuando cambian sus alturas?", "Conservar la progresión de 4 compases al acompañar e improvisar.", "Cantar y comprobar por oído el material antes de consultar soluciones."], "notationPolicy": {"defaultsRef": "../../course.json#/notationDefaultsByLevel/intermediate", "overrides": {}, "materialOverrides": []}, "theory": {"blocks": [{"blockId": "T01", "title": "Construcción y escucha", "text": "Un motivo combina ritmo, contorno y duración. Puedes desarrollarlo por repetición, desplazamiento rítmico, secuencia o reducción. Mantén una idea audible antes de agregar material nuevo."}, {"blockId": "T02", "title": "Aplicación y lectura", "text": "Las notas guía dan dirección a la frase aunque no comiencen en fundamental. Aquí cada compás usa tres ataques y un silencio; el oyente reconoce la familia rítmica."}]}, "musicalMaterials": [{"materialId": "concepto", "title": "1. Concepto: contraste en clave de fa", "musicXmlAssetId": "concepto-xml", "chordEventsSource": "derivedFromMusicXml", "chordEvents": [{"bar": 1, "beat": 1, "symbol": "Dm7", "durationBeats": 4}, {"bar": 2, "beat": 1, "symbol": "G7", "durationBeats": 4}, {"bar": 3, "beat": 1, "symbol": "Cmaj7", "durationBeats": 4}, {"bar": 4, "beat": 1, "symbol": "Am7", "durationBeats": 4}], "latinNoteLabels": [{"noteId": "concepto-b1-n1", "label": "Fa"}, {"noteId": "concepto-b1-n2", "label": "Do"}, {"noteId": "concepto-b1-n3", "label": "Fa"}, {"noteId": "concepto-b2-n1", "label": "Fa"}, {"noteId": "concepto-b2-n2", "label": "Si"}, {"noteId": "concepto-b2-n3", "label": "Fa"}, {"noteId": "concepto-b3-n1", "label": "Mi"}, {"noteId": "concepto-b3-n2", "label": "Si"}, {"noteId": "concepto-b3-n3", "label": "Mi"}, {"noteId": "concepto-b4-n1", "label": "Mi"}, {"noteId": "concepto-b4-n2", "label": "Sol"}, {"noteId": "concepto-b4-n3", "label": "Do"}], "description": "1. Concepto: contraste en clave de fa", "renderAssetIds": ["concepto-p1-png"], "audioAssetId": "concepto-audio", "noteRole": "theoryContrast"}, {"materialId": "progresion", "title": "2. Progresión: mapa y bajo guía en dos", "musicXmlAssetId": "progresion-xml", "chordEventsSource": "derivedFromMusicXml", "chordEvents": [{"bar": 1, "beat": 1, "symbol": "Dm7", "durationBeats": 4}, {"bar": 2, "beat": 1, "symbol": "G7", "durationBeats": 4}, {"bar": 3, "beat": 1, "symbol": "Cmaj7", "durationBeats": 4}, {"bar": 4, "beat": 1, "symbol": "Am7", "durationBeats": 4}], "latinNoteLabels": [{"noteId": "progresion-b1-n1", "label": "Re"}, {"noteId": "progresion-b1-n2", "label": "La"}, {"noteId": "progresion-b2-n1", "label": "Sol"}, {"noteId": "progresion-b2-n2", "label": "Re"}, {"noteId": "progresion-b3-n1", "label": "Do"}, {"noteId": "progresion-b3-n2", "label": "Sol"}, {"noteId": "progresion-b4-n1", "label": "La"}, {"noteId": "progresion-b4-n2", "label": "Mi"}], "description": "2. Progresión: mapa y bajo guía en dos", "renderAssetIds": ["progresion-p1-png"], "audioAssetId": "progresion-audio", "noteRole": "chordTones"}, {"materialId": "solo", "title": "3. Motivo original: una realización posible", "musicXmlAssetId": "solo-xml", "chordEventsSource": "derivedFromMusicXml", "chordEvents": [{"bar": 1, "beat": 1, "symbol": "Dm7", "durationBeats": 4}, {"bar": 2, "beat": 1, "symbol": "G7", "durationBeats": 4}, {"bar": 3, "beat": 1, "symbol": "Cmaj7", "durationBeats": 4}, {"bar": 4, "beat": 1, "symbol": "Am7", "durationBeats": 4}], "latinNoteLabels": [{"noteId": "solo-b1-n1", "label": "Fa"}, {"noteId": "solo-b1-n2", "label": "Do"}, {"noteId": "solo-b1-n3", "label": "Fa"}, {"noteId": "solo-b2-n1", "label": "Si"}, {"noteId": "solo-b2-n2", "label": "Fa"}, {"noteId": "solo-b2-n3", "label": "Si"}, {"noteId": "solo-b3-n1", "label": "Mi"}, {"noteId": "solo-b3-n2", "label": "Si"}, {"noteId": "solo-b3-n3", "label": "Mi"}, {"noteId": "solo-b4-n1", "label": "Do"}, {"noteId": "solo-b4-n2", "label": "Sol"}, {"noteId": "solo-b4-n3", "label": "Do"}], "description": "3. Motivo original: una realización posible", "renderAssetIds": ["solo-p1-png"], "audioAssetId": "solo-audio", "noteRole": "chordTones"}, {"materialId": "pattern", "title": "4. Pattern de escala: grupos de tres notas", "musicXmlAssetId": "pattern-xml", "chordEventsSource": "derivedFromMusicXml", "chordEvents": [{"bar": 1, "beat": 1, "symbol": "Cmaj7", "durationBeats": 4}, {"bar": 2, "beat": 1, "symbol": "Cmaj7", "durationBeats": 4}, {"bar": 3, "beat": 1, "symbol": "Cmaj7", "durationBeats": 4}, {"bar": 4, "beat": 1, "symbol": "Cmaj7", "durationBeats": 4}, {"bar": 5, "beat": 1, "symbol": "Cmaj7", "durationBeats": 4}], "latinNoteLabels": [{"noteId": "pattern-b1-n1", "label": "Do"}, {"noteId": "pattern-b1-n2", "label": "Re"}, {"noteId": "pattern-b1-n3", "label": "Mi"}, {"noteId": "pattern-b1-n4", "label": "Re"}, {"noteId": "pattern-b2-n1", "label": "Mi"}, {"noteId": "pattern-b2-n2", "label": "Fa"}, {"noteId": "pattern-b2-n3", "label": "Mi"}, {"noteId": "pattern-b2-n4", "label": "Fa"}, {"noteId": "pattern-b3-n1", "label": "Sol"}, {"noteId": "pattern-b3-n2", "label": "Fa"}, {"noteId": "pattern-b3-n3", "label": "Sol"}, {"noteId": "pattern-b3-n4", "label": "La"}, {"noteId": "pattern-b4-n1", "label": "Sol"}, {"noteId": "pattern-b4-n2", "label": "La"}, {"noteId": "pattern-b4-n3", "label": "Si"}, {"noteId": "pattern-b4-n4", "label": "La"}, {"noteId": "pattern-b5-n1", "label": "Si"}, {"noteId": "pattern-b5-n2", "label": "Do"}, {"noteId": "pattern-b5-n3", "label": "Do"}], "description": "4. Pattern de escala: grupos de tres notas", "renderAssetIds": ["pattern-p1-png"], "audioAssetId": "pattern-audio", "noteRole": "scalePattern"}, {"materialId": "oido", "title": "Verificación auditiva: respuestas al final", "musicXmlAssetId": "oido-xml", "chordEventsSource": "derivedFromMusicXml", "chordEvents": [{"bar": 1, "beat": 1, "symbol": "Dm7", "durationBeats": 4}, {"bar": 2, "beat": 1, "symbol": "Dm7", "durationBeats": 4}, {"bar": 3, "beat": 1, "symbol": "Am7", "durationBeats": 4}, {"bar": 4, "beat": 1, "symbol": "Am7", "durationBeats": 4}, {"bar": 5, "beat": 1, "symbol": "G7", "durationBeats": 4}, {"bar": 6, "beat": 1, "symbol": "G7", "durationBeats": 4}, {"bar": 7, "beat": 1, "symbol": "Dm7", "durationBeats": 4}, {"bar": 8, "beat": 1, "symbol": "Dm7", "durationBeats": 4}, {"bar": 9, "beat": 1, "symbol": "Cmaj7", "durationBeats": 4}, {"bar": 10, "beat": 1, "symbol": "Cmaj7", "durationBeats": 4}, {"bar": 11, "beat": 1, "symbol": "Am7", "durationBeats": 4}, {"bar": 12, "beat": 1, "symbol": "Am7", "durationBeats": 4}], "latinNoteLabels": [{"noteId": "oido-b1-n1", "label": "Fa"}, {"noteId": "oido-b1-n2", "label": "Do"}, {"noteId": "oido-b1-n3", "label": "Fa"}, {"noteId": "oido-b3-n1", "label": "Mi"}, {"noteId": "oido-b3-n2", "label": "Sol"}, {"noteId": "oido-b3-n3", "label": "Do"}, {"noteId": "oido-b5-n1", "label": "Fa"}, {"noteId": "oido-b5-n2", "label": "Si"}, {"noteId": "oido-b5-n3", "label": "Fa"}, {"noteId": "oido-b7-n1", "label": "Fa"}, {"noteId": "oido-b7-n2", "label": "Do"}, {"noteId": "oido-b7-n3", "label": "Fa"}, {"noteId": "oido-b9-n1", "label": "Mi"}, {"noteId": "oido-b9-n2", "label": "Si"}, {"noteId": "oido-b9-n3", "label": "Mi"}, {"noteId": "oido-b11-n1", "label": "Mi"}, {"noteId": "oido-b11-n2", "label": "Sol"}, {"noteId": "oido-b11-n3", "label": "Do"}], "description": "Verificación auditiva: respuestas al final", "renderAssetIds": ["oido-p1-png"], "audioAssetId": "oido-audio", "noteRole": "theoryContrast"}], "examples": [{"exampleId": "E01", "materialId": "concepto", "explanation": "Compara alturas y calidad; la escritura explica el contraste."}, {"exampleId": "E02", "materialId": "progresion", "explanation": "Cada compás conserva cuatro pulsos; ataques en 1 y 3."}, {"exampleId": "E03", "materialId": "solo", "explanation": "Modelo de motivo. Desarrolla después la consigna propia de improvisación; no es la única solución."}, {"exampleId": "E04", "materialId": "pattern", "explanation": "Grupos consecutivos de tres notas de C major. Los silencios completan el último compás."}], "readingExercises": [{"exerciseId": "L01", "prompt": "En concepto, compás 1, lee Dm7 y nombra las alturas en orden; señala cuáles son notas de acorde y cuáles son contraste o paso.", "materialId": "concepto", "bar": 1, "responseType": "orderedNotesAndChordRoles", "answerKey": {"latinNotes": ["Fa", "Do", "Fa"], "chordToneFlags": [true, true, true]}, "feedback": "Contrasta la calidad con la teoría. Un paso o contraste no cambia por sí solo el acorde escrito."}, {"exerciseId": "L02", "prompt": "En concepto, compás 2, lee G7 y nombra las alturas en orden; señala cuáles son notas de acorde y cuáles son contraste o paso.", "materialId": "concepto", "bar": 2, "responseType": "orderedNotesAndChordRoles", "answerKey": {"latinNotes": ["Fa", "Si", "Fa"], "chordToneFlags": [true, true, true]}, "feedback": "Contrasta la calidad con la teoría. Un paso o contraste no cambia por sí solo el acorde escrito."}, {"exerciseId": "L03", "prompt": "En concepto, compás 3, lee Cmaj7 y nombra las alturas en orden; señala cuáles son notas de acorde y cuáles son contraste o paso.", "materialId": "concepto", "bar": 3, "responseType": "orderedNotesAndChordRoles", "answerKey": {"latinNotes": ["Mi", "Si", "Mi"], "chordToneFlags": [true, true, true]}, "feedback": "Contrasta la calidad con la teoría. Un paso o contraste no cambia por sí solo el acorde escrito."}, {"exerciseId": "L04", "prompt": "En progresión, identifica fundamentales y cuenta compases. Explica qué prepara el último acorde al repetir.", "materi